{
  "schema_version": "2.0",
  "application_id": "00000000-0000-4000-8000-000000000099",
  "acknowledgement_id": "01JZZZZZZZZZZZZZZZZZZZZZZZ",
  "acknowledged_at": "2026-07-18T06:00:00.000Z",
  "connector": {
    "instance_id": "litellm-primary",
    "name": "litellm",
    "version": "1.0.0"
  },
  "configuration_version": 3,
  "configuration_etag": "sha256:aaaaaaaaaaaaaaaaaaaaaaaaaaaaaaaaaaaaaaaaaaaaaaaaaaaaaaaaaaaaaaaa",
  "state": "applied",
  "applied_at": "2026-07-18T06:00:00.000Z",
  "error": null
}
